NCT Number,Title,Acronym,Status,Study Results,Conditions,Interventions,Gender,Age,Phases,Enrollment,Study Type,URL
NCT04361877,Cardiovascular Prevention During COVID-19 Pandemic Lockdown in Young Adults (COLA Trial),,Completed,No Results Available,Cardiovascular Prevention Behaviour,,All,"18 Years and older   (Adult, Older Adult)",,1900,Observational,https://ClinicalTrials.gov/show/NCT04361877
NCT04344197,"Surgery During Covid-19: The Role of Asymptomatic Patients, a Survey",,Completed,No Results Available,Surgery|COVID|Asymptomatic Patient|Covid-19|Preventive Measures,Other: global survey,All,"Child, Adult, Older Adult",,1200,Observational,https://ClinicalTrials.gov/show/NCT04344197
NCT04362319,Burnout and Medical Errors in the Anaesthesiology Fraternity During Covid-19 Pandemic,,Completed,No Results Available,"Burnout, Professional|Depression|Medical Errors|Covid-19",Diagnostic Test: Questionnaire forms,All,"18 Years and older   (Adult, Older Adult)",,85,Observational,https://ClinicalTrials.gov/show/NCT04362319
NCT04366297,Intravascular Access of COVID-19 Patient Under Personal Protective Equipment,,Completed,No Results Available,Cardiac Arrest|Emergencies,Device: Intravenous access|Device: Intraosseous access,All,"18 Years and older   (Adult, Older Adult)",Not Applicable,41,Interventional,https://ClinicalTrials.gov/show/NCT04366297
NCT04375501,A Study of Outcomes in Patients With Fractured Neck of Femur During the COVID-19 Pandemic,,Completed,No Results Available,Femoral Neck Fractures|SARS-CoV 2,"Other: Surgery: Dynamic Hip Screw, hemiarthroplasty, hip replacement, intramedullary nail",All,"18 Years and older   (Adult, Older Adult)",,442,Observational,https://ClinicalTrials.gov/show/NCT04375501
NCT04347408,Seroprevalence of SARS-Cov-2 Antibodies in Children,,Completed,No Results Available,COVID|Corona Virus Infection,Diagnostic Test: Covid-19 Antibody testing (IgG and IgM),All,2 Years to 15 Years   (Child),,1000,Observational,https://ClinicalTrials.gov/show/NCT04347408
NCT04817280,COVID-19 in Polish Ice Swimmers.,ICE,Completed,No Results Available,"Covid19|SARS-CoV Infection|Resistance, Disease|Hypothermia|Hypothermia Due to Cold Environment",Other: Ice Swimming,All,"Child, Adult, Older Adult",,2534,Observational,https://ClinicalTrials.gov/show/NCT04817280
NCT04532632,Taste and Smell Impairment in Critically Ill COVID-19 Patients,,Completed,No Results Available,Smell Disorder|Taste Disorders|Coronavirus Infection,,All,"18 Years to 80 Years   (Adult, Older Adult)",,40,Observational,https://ClinicalTrials.gov/show/NCT04532632
NCT04275414,Bevacizumab in Severe or Critical Patients With COVID-19 Pneumonia,BEST-CP,Completed,No Results Available,Coronavirus Infections,Drug: Bevacizumab Injection,All,"18 Years to 80 Years   (Adult, Older Adult)",Phase 2,27,Interventional,https://ClinicalTrials.gov/show/NCT04275414
NCT04894331,Telemedicine for SNAS Patients in COVID-19 Pandemic,DISTANCE,Completed,No Results Available,Systemic Nickel Allergic Syndrome,Other: Dietary intervention|Other: Video call,All,"18 Years to 65 Years   (Adult, Older Adult)",,20,Observational,https://ClinicalTrials.gov/show/NCT04894331
NCT04395144,COVid-19: Awake Proning and High-flow Nasal Cannula in respiratorY DistrEss,COVAYDE,Completed,No Results Available,Coronavirus Infection|COVID|Severe Acute Respiratory Syndrome|Respiratory Failure|Respiratory Insufficiency|Respiratory Distress Syndrome|ARDS|Lung Diseases,Procedure: Awake Prone Positioning|Procedure: Standard care,All,"18 Years and older   (Adult, Older Adult)",Not Applicable,13,Interventional,https://ClinicalTrials.gov/show/NCT04395144
NCT04453579,"Bariatric Surgery During Lockdown, Impact of COVID-19 on Physical and Mental Health",,Completed,No Results Available,Obese|Morbid Obesity,Behavioral: Telephonic interview during the Italian lockdown.,All,"18 Years to 65 Years   (Adult, Older Adult)",,116,Observational,https://ClinicalTrials.gov/show/NCT04453579
NCT04359875,A Phone-call With a Student/General Practitioner Team to Impact Morbidity of Chronic Patients During COVID-19 Containment,COVIQuest,Completed,No Results Available,Cardiovascular Diseases|Mental Disorder,Behavioral: Phone-call screening and management by a medical student/general practitioner tandem,All,"18 Years to 110 Years   (Adult, Older Adult)",Not Applicable,22000,Interventional,https://ClinicalTrials.gov/show/NCT04359875
NCT04445506,Short Term Corticosteroids in SARS-CoV2 Patients,,Completed,No Results Available,Corticosteroids|Covid19|SARS-CoV 2|Steroids|Dexamethasone,Drug: Dexamethasone,All,"18 Years and older   (Adult, Older Adult)",,50,Observational,https://ClinicalTrials.gov/show/NCT04445506
NCT04797624,Does Coronavirus Disease 2019 (COVID-19) Pandemic Cause a Delay in the Diagnosis of Gastric Cancer Patients?,,Completed,No Results Available,Stomach Cancer|Corona Virus Infection,Procedure: Gastric cancer surgery,All,"18 Years to 95 Years   (Adult, Older Adult)",,146,Observational,https://ClinicalTrials.gov/show/NCT04797624
NCT04513847,PsoVac: Educational Needs re Vaccines for Biologic Patients With Psoriasis,,Completed,No Results Available,Psoriasis|Covid19,,All,"Child, Adult, Older Adult",,661,Observational,https://ClinicalTrials.gov/show/NCT04513847
NCT04487197,"SARS-CoV2 (COVID-19) Seroepidemiological Transplanted Subjects (Kidney, Kidney-pancreas, Pancreas, Langerhans Islets)",,Completed,No Results Available,Kidney Transplant|Pancreatic Transplat|Pancreatic Islets Langerhans,Procedure: blood sample for seroepidemiological investigation,All,"18 Years and older   (Adult, Older Adult)",,282,Observational,https://ClinicalTrials.gov/show/NCT04487197
NCT04445961,Respiratory Mechanics and Gas Exchange in Patients With COVID-19 and Hypoxemic Acute Respiratory Failure,COVID-VENT,Completed,No Results Available,SARS Pneumonia,Diagnostic Test: Respiratory mechanics measurement|Diagnostic Test: Gas exchange measurement,All,"18 Years to 90 Years   (Adult, Older Adult)",,117,Observational,https://ClinicalTrials.gov/show/NCT04445961
NCT04323592,Methylprednisolone for Patients With COVID-19 Severe Acute Respiratory Syndrome,MP-C19,Completed,Has Results,"Severe Acute Respiratory Syndrome (SARS) Pneumonia|Coronavirus Infections|ARDS, Human",Drug: Methylprednisolone|Other: standard care,All,"18 Years to 80 Years   (Adult, Older Adult)",,173,Observational,https://ClinicalTrials.gov/show/NCT04323592
NCT04371419,COVID-19 Health Messaging to Underserved Communities,,Completed,No Results Available,Coronavirus,Behavioral: Messaging,All,"18 Years and older   (Adult, Older Adult)",Not Applicable,15475,Interventional,https://ClinicalTrials.gov/show/NCT04371419
NCT04377776,"Observational Study Concerning COVID-19 Infection in Transplanted Kidney, Pancreas or Pancreatic Islet Patients",,Completed,No Results Available,Kidney Transplant|Pancreas Tranplant|Pancreatic Islet Transplantation,Other: Practice details,All,"18 Years to 90 Years   (Adult, Older Adult)",,644,Observational,https://ClinicalTrials.gov/show/NCT04377776
NCT04761874,Telestroke at Comprehensive Stroke Center During the COVID-19 Pandemic,TELECAST-CSC,Completed,No Results Available,"Stroke, Acute",Other: Telestroke,All,"18 Years and older   (Adult, Older Adult)",Not Applicable,296,Interventional,https://ClinicalTrials.gov/show/NCT04761874
NCT04426318,COVID-19 and the Healthy Minds Program for Educators,CAHMP-ED,Completed,No Results Available,Anxiety|Depression|Psychological Stress|Psychological Distress|Well-being,Behavioral: Healthy Minds Program Foundations Training,All,"18 Years and older   (Adult, Older Adult)",Not Applicable,733,Interventional,https://ClinicalTrials.gov/show/NCT04426318
NCT04460027,W-SUDs for COVID-19,,Completed,No Results Available,Substance Use Disorders|Alcohol Use Disorder,Other: Woebot Substance Use Disorder,All,"18 Years to 65 Years   (Adult, Older Adult)",Phase 1,180,Interventional,https://ClinicalTrials.gov/show/NCT04460027
NCT04839913,"Seroprevalence of SARS-CoV-2 in Unselected Surgical Patients: an Unicentric, Regional Study",COVID-19,Completed,No Results Available,SARS-CoV Infection|Seroprevalence|Covid19,Diagnostic Test: Antibodies testing,All,"18 Years and older   (Adult, Older Adult)",,121,Observational,https://ClinicalTrials.gov/show/NCT04839913
NCT04402970,Dornase Alfa for ARDS in Patients With Severe Acute Respiratory Syndrome-Coronavirus-2 (SARS-CoV-2),DORNASESARS2,Completed,Has Results,SARS-CoV 2|ARDS,Drug: Dornase Alfa Inhalation Solution,All,"18 Years and older   (Adult, Older Adult)",Phase 3,30,Interventional,https://ClinicalTrials.gov/show/NCT04402970
NCT04501432,Cardiac Rehabilitation and Ongoing Physical Activity During COVID-19,CODIS,Completed,No Results Available,Cardiac Rehabilitation,Other: No intervention,All,"18 Years and older   (Adult, Older Adult)",,27,Observational,https://ClinicalTrials.gov/show/NCT04501432
NCT04365608,Prehospital Intubation of COVID-19 Patient With Personal Protective Equipment,,Completed,No Results Available,Intubation Complication|Intubation; Difficult or Failed|Cardiac Arrest|Influenza|Safety Issues,Procedure: Direct laryngoscopy|Procedure: Vie Scope laryngoscopy,All,"18 Years and older   (Adult, Older Adult)",Not Applicable,90,Interventional,https://ClinicalTrials.gov/show/NCT04365608
NCT04415359,Evaluation of the Evolution of Pregnancies in the First Trimester Following MAR Management During a COVD-19 Pandemic Period,AMPCOVID-19,Completed,No Results Available,Covid-19,,Female,18 Years to 43 Years   (Adult),,700,Observational,https://ClinicalTrials.gov/show/NCT04415359
NCT04363593,Serology COVID-19 From the Cornwall Hospital Union,ROCOCO,Completed,No Results Available,Corona Virus Infection,Biological: Serological test|Biological: Serum test,All,"18 Years and older   (Adult, Older Adult)",Not Applicable,2587,Interventional,https://ClinicalTrials.gov/show/NCT04363593
NCT04451993,Physical Activity Level in Patients With OSAS During Covid-19 Pandemic,,Completed,No Results Available,Obstructive Sleep Apnea-hypopnea Syndrome,,All,"19 Years to 70 Years   (Adult, Older Adult)",,63,Observational,https://ClinicalTrials.gov/show/NCT04451993
NCT04758039,Clinical Characteristics and In-hospital Death of a Chilean COVID-19 Prospective Cohort,,Completed,No Results Available,Corona Virus Infection,,All,"18 Years and older   (Adult, Older Adult)",,395,Observational,https://ClinicalTrials.gov/show/NCT04758039
NCT04604769,Perceived Stress Among ICU Medical Staff During COVID-19 Crisis,ICUcovid,Completed,No Results Available,Coronavirus|Nurse's Role|Professional Stress,,All,"18 Years and older   (Adult, Older Adult)",,60,Observational,https://ClinicalTrials.gov/show/NCT04604769
NCT04370210,Sleep Quality During COVID-19 Containment in Children Whether or Not Usually Followed in Child Psychiatry,CONFIDODO,Completed,No Results Available,Sleep Disturbance,Behavioral: Questionnaires,All,7 Years to 12 Years   (Child),,247,Observational,https://ClinicalTrials.gov/show/NCT04370210
NCT04371848,Impact of the COVID-19 Pandemic on Diet Quality and Food Insecurity: a NutriQuébec Sub-study,,Completed,No Results Available,Eating Habits,,All,"18 Years and older   (Adult, Older Adult)",,2465,Observational,https://ClinicalTrials.gov/show/NCT04371848
NCT04374097,Level and Predictors of Trauma-symptoms Among Health Workers and Public Service Providers During the COVID-19 Outbreak,,Completed,No Results Available,Post Traumatic Stress Disorder|Anxiety|Depression,,All,"18 Years and older   (Adult, Older Adult)",,1778,Observational,https://ClinicalTrials.gov/show/NCT04374097
NCT04377074,Parental Stress During the COVID-19 Pandemic and Its Association With Depression and Anxiety,,Completed,No Results Available,Parental Stress|Depression|Anxiety,,All,"18 Years and older   (Adult, Older Adult)",,2880,Observational,https://ClinicalTrials.gov/show/NCT04377074
NCT04381000,Quarantine and Telerehabilitation in Chronic Pain Patients During COVID-19 Pandemic.,,Completed,No Results Available,Chronic Pain,Other: Exercise Group,All,"18 Years to 80 Years   (Adult, Older Adult)",Not Applicable,170,Interventional,https://ClinicalTrials.gov/show/NCT04381000
NCT04340219,"Oncology-patient-reported Anxiety, Mood, and QoL During the COVID-19 Pandemic",ONCOVID,Completed,No Results Available,Cancer,Other: Survey administration,All,"18 Years and older   (Adult, Older Adult)",,394,Observational,https://ClinicalTrials.gov/show/NCT04340219
NCT04387799,Determinants of COVID-19 Pneumonia (MC-19),MC-19,Completed,No Results Available,"Pneumonia, Viral|Pneumonia, Bacterial|Coronavirus Infection|Obstructive Lung Disease",Diagnostic Test: Serology for Covid-19,All,"18 Years to 100 Years   (Adult, Older Adult)",,520,Observational,https://ClinicalTrials.gov/show/NCT04387799
NCT04859023,Comparison of Strategies Based on RT-PCR or Antigenic Test for the Screening of SARS-CoV-2 Infection (COVID-19).,AutoCoV,Completed,No Results Available,SARS-CoV Infection,Diagnostic Test: saliva sample combined to an anterior nare self-swabbing (Self-samples)|Diagnostic Test: saliva sample (Self-sample)|Other: Survey of SARS-COV-19 knowledge|Other: Survey of acceptability of the different self-samples.,All,"10 Years and older   (Child, Adult, Older Adult)",Not Applicable,10000,Interventional,https://ClinicalTrials.gov/show/NCT04859023
NCT04511949,COVID-19: Epidemiological Study of the Spread of SARS-CoV-2 in the Household of a Person Who Has Had a COVID-19 Disease,FAMICOV,Completed,No Results Available,Coronavirus Infection,"Diagnostic Test: COVID-19 IgG / IgM rapid test (whole blood, serum, plasma)",All,"3 Years and older   (Child, Adult, Older Adult)",Not Applicable,500,Interventional,https://ClinicalTrials.gov/show/NCT04511949
NCT04845880,SARS Cov_2 Incidence of Healthy Health Workers,,Completed,No Results Available,SARS COV-2 IgG Levels on Health Workers,Diagnostic Test: Spike protein (S) or the nucleocapsid (N) of SARS-CoV-2,All,"18 Years to 65 Years   (Adult, Older Adult)",Not Applicable,182,Interventional,https://ClinicalTrials.gov/show/NCT04845880
NCT04604080,Post-COVID-19 Epidemic Depression Assessment in Adults in South Punjab Pakistan,,Completed,No Results Available,"Depression, Anxiety",Other: service of questionnaire,All,"Child, Adult, Older Adult",,390,Observational,https://ClinicalTrials.gov/show/NCT04604080
NCT04356885,COVID-19 and Psychotic Symptoms in France,SCHIZOVID-19,Completed,No Results Available,Mental Disorder,,All,"18 Years to 65 Years   (Adult, Older Adult)",,600,Observational,https://ClinicalTrials.gov/show/NCT04356885
NCT04694664,COVID-19 Vaccine Confidence Among Pregnant Women and Mothers,VCCOVID,Completed,No Results Available,Pregnancy Related|Mothers,Other: This is an online survey with no intervention.,Female,"18 Years to 65 Years   (Adult, Older Adult)",,18000,Observational,https://ClinicalTrials.gov/show/NCT04694664
NCT04447638,Percutaneous Tracheostomy With COVID-19,,Completed,No Results Available,Tracheostomy,Procedure: Tracheostomy with aerosol box in COVID-19 positive patients,All,"18 Years to 90 Years   (Adult, Older Adult)",,24,Observational,https://ClinicalTrials.gov/show/NCT04447638
NCT04556604,Surgical Consent During the COVID-19 Pandemic,,Completed,No Results Available,Consent,Behavioral: Educational meetings and visual prompts,All,"18 Years and older   (Adult, Older Adult)",,45,Observational,https://ClinicalTrials.gov/show/NCT04556604
NCT04417374,"Caracteristics of the Patients Hospitalized With Unvonluntary Commitment Procedure, in the Context COVID-19",HoCoPsy,Completed,No Results Available,COVID 19|Disease Outbreak|Mental Disorders,Other: Description of groups caracteristics,All,"18 Years and older   (Adult, Older Adult)",,94,Observational,https://ClinicalTrials.gov/show/NCT04417374
NCT04429477,Cerebral Compliance Impairment in COVID-19,,Completed,No Results Available,Intracranial Hypertension|Cerebral Circulatory Failure,Device: Cerebral compliance and hemodynamics monitoring,All,"1 Year and older   (Child, Adult, Older Adult)",,50,Observational,https://ClinicalTrials.gov/show/NCT04429477
NCT04424836,HFNC Treatment in COVID-19 Pneumonia,,Completed,No Results Available,"Coronavirus Infection|Pneumonia, Viral|Acute Respiratory Failure",Device: high flow nasal cannula device,All,"18 Years and older   (Adult, Older Adult)",,43,Observational,https://ClinicalTrials.gov/show/NCT04424836
NCT04356365,The Mental Health Status of the General Population During the COVID-19 Pandemic and Its Association With Adherence to Government-initiated Non-pharmacological Epidemiological Interventions (NPI's),,Completed,No Results Available,Depression|Generalized Anxiety|Adherence to Non-pharmacological Epidemiological Interventions (NPIs),Other: Cross-sectional study investigating the association of NPIs with mental health,All,"18 Years and older   (Adult, Older Adult)",,10084,Observational,https://ClinicalTrials.gov/show/NCT04356365
NCT04431284,Impact of COVID-19 Lockdown on Obesity and Eating Behaviors,CIO,Completed,No Results Available,Feeding and Eating Disorders,Other: Questionnaires,All,"18 Years and older   (Adult, Older Adult)",,37,Observational,https://ClinicalTrials.gov/show/NCT04431284
NCT04727372,Social Acceptability of COVID-19 Vaccines in Pakistan,,Completed,No Results Available,"Social Acceptance, Social Anxiety",Other: Questionnaire,All,"16 Years and older   (Child, Adult, Older Adult)",,986,Observational,https://ClinicalTrials.gov/show/NCT04727372
NCT04335279,Evaluation of the Scleroderma Patient-centered Intervention Network COVID-19 Home-isolation Activities Together Program,SPIN-CHAT,Completed,No Results Available,"Scleroderma|Scleroderma, Systemic|Systemic Sclerosis",Other: SPIN-CHAT Program,All,"18 Years and older   (Adult, Older Adult)",Not Applicable,172,Interventional,https://ClinicalTrials.gov/show/NCT04335279
NCT04678778,Virtual Reality Study - COVID-19 Protocol,NRVR,Completed,No Results Available,Healthy Aging,Behavioral: Physical and Cognitive Activity,All,"50 Years to 85 Years   (Adult, Older Adult)",Not Applicable,14,Interventional,https://ClinicalTrials.gov/show/NCT04678778
NCT04379531,LDCT in COVID-19 Pneumonia: a Prospective Moscow Study,LDCTiP,Completed,No Results Available,Pneumonia|Coronavirus Infection,Diagnostic Test: Low-dose Chest CT,All,"18 Years and older   (Adult, Older Adult)",Not Applicable,230,Interventional,https://ClinicalTrials.gov/show/NCT04379531
NCT04874779,Acute Kidney Injury Risk in COVID-19,,Completed,No Results Available,Sever Acute Respiratory Syndrome and Acute Kidney Injury,Other: non,All,"18 Years and older   (Adult, Older Adult)",,83,Observational,https://ClinicalTrials.gov/show/NCT04874779
NCT04337502,Clinical and Radiomic Model of COVID-19,,Completed,No Results Available,Coronavirus|Machine Learning,Diagnostic Test: Machine learning model,All,"Child, Adult, Older Adult",,300,Observational,https://ClinicalTrials.gov/show/NCT04337502
NCT04337047,Distress in Crisis Situations During COVID-19,,Completed,No Results Available,"Stress, Psychological",Other: questionnaire assesment,All,"18 Years and older   (Adult, Older Adult)",,2000,Observational,https://ClinicalTrials.gov/show/NCT04337047
NCT04891276,Impact of COVID-19 Infection and Confinement on Diabetic Ulcer Management and Amputation Risk,COROPIEDIAB,Completed,No Results Available,Diabetic Subjects With Hospital Stays,Other: Data collection,All,"Child, Adult, Older Adult",,3300000,Observational,https://ClinicalTrials.gov/show/NCT04891276
NCT04728594,Emails Promoting COVID-19 Vaccination Among Healthcare Workers,,Completed,No Results Available,Vaccination Refusal|Communication,Behavioral: Social Proof|Behavioral: Reframing|Behavioral: Scarcity Message,All,"Child, Adult, Older Adult",Not Applicable,9656,Interventional,https://ClinicalTrials.gov/show/NCT04728594
NCT04368377,Enhanced Platelet Inhibition in Critically Ill Patients With COVID-19,PIC-19,Completed,No Results Available,"Pneumonia, Viral|Corona Virus Infection|Respiratory Failure|Embolism and Thrombosis",Drug: Tirofiban Injection|Drug: Clopidogrel|Drug: Acetylsalicylic acid|Drug: Fondaparinux,All,"18 Years and older   (Adult, Older Adult)",Phase 2,5,Interventional,https://ClinicalTrials.gov/show/NCT04368377
NCT04572399,UVA Light Device to Treat COVID-19,,Completed,No Results Available,Coronavirus,Device: UV Light Treatment,All,"18 Years and older   (Adult, Older Adult)",Not Applicable,5,Interventional,https://ClinicalTrials.gov/show/NCT04572399
NCT04668937,Conséquences of the COVID-19 Lockdown Measures on the CHRU Nancy Pediatric Emergency Services,,Completed,No Results Available,Number of Patients During the Studying Period|Reason for Consultation,,All,up to 17 Years   (Child),,11000,Observational,https://ClinicalTrials.gov/show/NCT04668937
NCT04324684,Prognostic Factors Keeping Track for COVID-19 Pneumonia,NIKE_C19,Completed,No Results Available,"Pneumonia, Viral|Hypertension|Diabetes Mellitus|Obesity|Cardiovascular Diseases|Obstructive Lung Disease",,All,"18 Years to 100 Years   (Adult, Older Adult)",,198,Observational,https://ClinicalTrials.gov/show/NCT04324684
NCT04410692,Can the Prediction Market Improve Predictions of COVID-19?,,Completed,No Results Available,"Health Knowledge, Attitudes, Practice",Other: Prediction Market,All,"18 Years and older   (Adult, Older Adult)",Not Applicable,560,Interventional,https://ClinicalTrials.gov/show/NCT04410692
NCT04730934,Effects of the COVID-19 Pandemic on Fibromyalgia Patients,,Completed,No Results Available,Fibromyalgia|Chronic Low-back Pain,"Other: Perceived stress scale|Other: Fibromyalgia impact questionnaire|Other: The drugs used before and during the pandemic, the patient's job status, physical activity conditions, pain status",All,"18 Years to 65 Years   (Adult, Older Adult)",,1360,Observational,https://ClinicalTrials.gov/show/NCT04730934
NCT04379245,COVID-19 Infection in Patients Infected With HIV and/or on PrEP,COVIDHIVPrEP,Completed,No Results Available,HIV|Pre-exposure Prophylaxis,"Other: Data research, database analysis",All,"18 Years and older   (Adult, Older Adult)",,4200,Observational,https://ClinicalTrials.gov/show/NCT04379245
NCT04306055,Blood Donor Recruitment During Epidemic of COVID-19,,Completed,No Results Available,Blood Donation,Other: Questionnaire with precaution information|Other: Experimental: Questionnaire without precaution information,All,18 Years to 60 Years   (Adult),Not Applicable,19491,Interventional,https://ClinicalTrials.gov/show/NCT04306055
NCT04400006,Ozone Therapy in the Prevention of COVID-19 Infection,,Completed,No Results Available,Corona Virus Infection,,All,"18 Years to 90 Years   (Adult, Older Adult)",,71,Observational,https://ClinicalTrials.gov/show/NCT04400006
NCT04370886,Recruit Blood Donors Via SMS During Epidemic of COVID-19,,Completed,No Results Available,Blood Donation,Behavioral: blood donation SMS,All,18 Years to 60 Years   (Adult),Not Applicable,456517,Interventional,https://ClinicalTrials.gov/show/NCT04370886
NCT04665193,An Approach to Screening for COVID-19 at Vancouver Airport,,Completed,No Results Available,Asymptomatic Condition|Healthy,Diagnostic Test: Rapid Antigen Test,All,"13 Years to 90 Years   (Child, Adult, Older Adult)",Not Applicable,592,Interventional,https://ClinicalTrials.gov/show/NCT04665193
NCT04440098,Isolated During COVID-19: Effects of COVID-19's Social Restrictions on Loneliness and Psychosocial Symptomatology,,Completed,No Results Available,Loneliness|Depression|Anxiety|Alcohol Abuse|Drug Abuse,,All,18 Years to 35 Years   (Adult),,1008,Observational,https://ClinicalTrials.gov/show/NCT04440098
NCT04718519,Migrant Workers' Responses to the COVID-19 Pandemic,,Completed,No Results Available,Coronavirus|Trust|Misinformation,,Male,21 Years to 60 Years   (Adult),,1011,Observational,https://ClinicalTrials.gov/show/NCT04718519
NCT04425863,"Ivermectin, Aspirin, Dexamethasone and Enoxaparin as Treatment of Covid 19",IDEA,Completed,Has Results,Severe Acute Respiratory Syndrome|Ventilation Pneumonitis,"Drug: Ivermectin 5 MG/ML oral solution, Aspirin 250 mg tablets|Other: Ivermectin 5 mg/mL oral solution, Dexamethasone 4-mg injection, Aspirin 250 mg tablets|Other: Ivermectin 5 MG/ML oral solution, Dexamethasone 4-mg injection, Enoxaparin injection. Inpatient treatment with mechanical ventilation in ICU.",All,"5 Years and older   (Child, Adult, Older Adult)",,167,Observational,https://ClinicalTrials.gov/show/NCT04425863
NCT04416308,COVID 19 : Seroprevalence Study of Anti SRAS-CoV-2 Antibodies in GHT Employees in Haute Bretagne (AntiCoV-HB),AntiCoV-HB,Completed,No Results Available,Coronavirus,Diagnostic Test: NG test|Diagnostic Test: Blood test|Behavioral: Self-questionnary,All,"18 Years and older   (Adult, Older Adult)",Not Applicable,9453,Interventional,https://ClinicalTrials.gov/show/NCT04416308
NCT04435106,Compassionate Use of Opaganib in Patients With Coronavirus Disease 2019 (COVID-19),,Completed,No Results Available,Coronavirus Infections,Drug: Opaganib|Drug: Standard of Care,All,"18 Years to 80 Years   (Adult, Older Adult)",,23,Observational,https://ClinicalTrials.gov/show/NCT04435106
NCT04444661,Effects of COVID-19 Induced Deconditioning After Long-term High Intensity Resistance Exercise,,Completed,No Results Available,Osteoporosis|Sarcopenia,,Male,74 Years to 95 Years   (Older Adult),,21,Observational,https://ClinicalTrials.gov/show/NCT04444661
NCT04420806,Effects of COVID-19 Lockdown in Exercising Early Postmenopausal Women,,Completed,No Results Available,Exercise|Detraining|Muscle Weakness|Muscle Atrophy,Other: HIT-exercise|Other: Sham intervention,Female,48 Years to 60 Years   (Adult),Not Applicable,21,Interventional,https://ClinicalTrials.gov/show/NCT04420806
